{
  "$schema": "./layoverjoy-entry-rule.schema.json",
  "schemaVersion": "2.0.0",
  "dataset": {
    "datasetId": "layoverjoy-cn-ordinary-passport-entry-rules",
    "nameZh": "LayoverJoy 中国普通护照入境与过境规则库",
    "asOf": "2026-08-30",
    "generatedFor": "LayoverJoy hackathon MVP and Qoder implementation",
    "legalNoticeZh": "本数据仅用于行程资格预筛，不构成法律、领事或入境保证。边检、领馆、承运人和目的地主管机关的实时决定具有最终效力。缺少事实、来源过期或规则冲突时必须返回 NEEDS_INFO 或 NEEDS_REVIEW，不得推断为可入境。",
    "checksum": null
  },
  "subject": {
    "nationalityCountryCode": "CN",
    "passportIssuingCountryCode": "CN",
    "passportType": "ORDINARY"
  },
  "policy": {
    "defaultSearchDecision": "NEEDS_REVIEW",
    "defaultBookingDecision": "NEEDS_REVIEW",
    "borderAuthorityIsFinal": true,
    "llmMayDecideEligibility": false,
    "sourceTierReviewDays": {
      "A_DESTINATION_AUTHORITY": 90,
      "B_CHINESE_MFA": 120,
      "C_OFFICIAL_AGGREGATE": 30
    },
    "temporaryRuleSafetyHours": 72
  },
  "referenceGroups": [
    {
      "groupId": "SCHENGEN_CURRENT",
      "labelZh": "申根区成员",
      "memberType": "COUNTRY_CODE",
      "members": ["AT", "BE", "BG", "HR", "CZ", "DK", "EE", "FI", "FR", "DE", "GR", "HU", "IS", "IT", "LV", "LI", "LT", "LU", "MT", "NL", "NO", "PL", "PT", "RO", "SK", "SI", "ES", "SE", "CH"],
      "asOf": "2026-08-30",
      "sourceIds": []
    },
    {
      "groupId": "KOREA_APPROVED_EUROPE_32",
      "labelZh": "韩国第三国过境政策指定的 32 个欧洲国家",
      "memberType": "COUNTRY_CODE",
      "members": ["GR", "NL", "NO", "DK", "DE", "LV", "RO", "LU", "LT", "LI", "MT", "BE", "BG", "CY", "SE", "CH", "ES", "SK", "SI", "IS", "IE", "EE", "GB", "AT", "IT", "CZ", "HR", "PT", "PL", "FR", "FI", "HU"],
      "asOf": "2026-08-30",
      "sourceIds": ["KR-MOFA-TRANSIT-2025"]
    },
    {
      "groupId": "KOREA_ADVANCED_FOUR",
      "labelZh": "韩国第三国过境政策指定的四国",
      "memberType": "COUNTRY_CODE",
      "members": ["US", "CA", "AU", "NZ"],
      "asOf": "2026-08-30",
      "sourceIds": ["KR-MOFA-TRANSIT-2025"]
    },
    {
      "groupId": "MEXICO_QUALIFYING_VISA_ISSUERS",
      "labelZh": "墨西哥条件免签认可的签证签发地",
      "memberType": "COUNTRY_CODE",
      "members": ["US", "CA", "JP", "GB", "AT", "BE", "BG", "HR", "CZ", "DK", "EE", "FI", "FR", "DE", "GR", "HU", "IS", "IT", "LV", "LI", "LT", "LU", "MT", "NL", "NO", "PL", "PT", "RO", "SK", "SI", "ES", "SE", "CH"],
      "asOf": "2026-08-30",
      "sourceIds": ["MX-MFA-CONDITIONAL"]
    }
  ],
  "sourceDocuments": [
    {
      "sourceId": "CN-MFA-MUTUAL-20260529",
      "authority": "中华人民共和国外交部领事司",
      "title": "中外互免签证协定一览表（更新至2026年5月29日）",
      "url": "https://cs.mfa.gov.cn/gyls/lsgz/fwxx/202504/t20250414_11594222.shtml",
      "tier": "B_CHINESE_MFA",
      "language": "zh-CN",
      "sourcePublishedAt": null,
      "sourceUpdatedAt": "2026-05-29",
      "lastCheckedAt": "2026-08-30T12:00:00+08:00",
      "status": "CURRENT",
      "supportsAutoDecision": false,
      "summaryZh": "确认普通护照互免协定国家和生效日期；具体停留天数仍应查目的地主管机关或协定全文。"
    },
    {
      "sourceId": "CN-MFA-CONVENIENCE-202311",
      "authority": "中华人民共和国外交部领事司",
      "title": "持普通护照中国公民前往有关国家和地区入境便利待遇一览表",
      "url": "https://cs.mfa.gov.cn/zggmcg/cgqz/qzxx_660462/202110/P020231208361019295346.pdf",
      "tier": "C_OFFICIAL_AGGREGATE",
      "language": "zh-CN",
      "sourcePublishedAt": "2023-11-01",
      "sourceUpdatedAt": "2023-11-01",
      "lastCheckedAt": "2026-08-30T12:00:00+08:00",
      "status": "STALE",
      "supportsAutoDecision": false,
      "summaryZh": "用于建立覆盖候选清单，不得直接作为自动放行依据；其中多项临时政策已经变化。"
    },
    {
      "sourceId": "HK-IMMD-PRC-TRANSIT",
      "authority": "香港特别行政区入境事务处",
      "title": "Entry Arrangements for Mainland, Macao, Taiwan and Overseas Chinese Residents",
      "url": "https://www.immd.gov.hk/eng/services/visas/overseas-chinese-entry-arrangement.html",
      "tier": "A_DESTINATION_AUTHORITY",
      "language": "en",
      "sourcePublishedAt": null,
      "sourceUpdatedAt": null,
      "lastCheckedAt": "2026-08-30T12:00:00+08:00",
      "status": "CURRENT",
      "supportsAutoDecision": true,
      "summaryZh": "中国护照持有人真实过境前往或来自第三国/地区，每次可获最多7天停留，需满足正常入境条件、目的地入境资格和已确认续程。"
    },
    {
      "sourceId": "MO-PSP-PRC-TRANSIT",
      "authority": "澳门特别行政区治安警察局",
      "title": "内地居民持中国护照过境澳门",
      "url": "https://www.fsm.gov.mo/PSP/cht/psp_top7_sm_2_1.html",
      "tier": "A_DESTINATION_AUTHORITY",
      "language": "zh-HK",
      "sourcePublishedAt": null,
      "sourceUpdatedAt": null,
      "lastCheckedAt": "2026-08-30T12:00:00+08:00",
      "status": "CURRENT",
      "supportsAutoDecision": true,
      "summaryZh": "真实经澳门国际机场往返外国，具备目的地签证和运输凭证时最多停留7天；护照有效期需覆盖拟停留期并额外至少90天。"
    },
    {
      "sourceId": "MY-IMM-MUTUAL-FAQ",
      "authority": "Immigration Department of Malaysia",
      "title": "Malaysia-China Mutual Visa Exemption FAQ",
      "url": "https://malaysiavisa.imi.gov.my/faq/",
      "tier": "A_DESTINATION_AUTHORITY",
      "language": "en",
      "sourcePublishedAt": null,
      "sourceUpdatedAt": null,
      "lastCheckedAt": "2026-08-30T12:00:00+08:00",
      "status": "CURRENT",
      "supportsAutoDecision": true,
      "summaryZh": "自2025年7月17日起，普通护照短期访问单次最多30天，任意180天累计不超过90天，并要求至少6个月护照有效期和MDAC。"
    },
    {
      "sourceId": "TH-MFA-MUTUAL-2024",
      "authority": "Ministry of Foreign Affairs, Kingdom of Thailand",
      "title": "Thailand-China Mutual Visa Exemption Agreement",
      "url": "https://www.mfa.go.th/en/content/thcn280124?cate=5d5bcb4e15e39c306000683c",
      "tier": "A_DESTINATION_AUTHORITY",
      "language": "en",
      "sourcePublishedAt": "2024-01-28",
      "sourceUpdatedAt": "2024-01-28",
      "lastCheckedAt": "2026-08-30T12:00:00+08:00",
      "status": "CURRENT",
      "supportsAutoDecision": true,
      "summaryZh": "自2024年3月1日起，单次最多30天，任意180天累计不超过90天；居留、工作、学习、媒体等目的不适用。"
    },
    {
      "sourceId": "SG-ICA-MUTUAL-2024",
      "authority": "Immigration & Checkpoints Authority Singapore",
      "title": "Mutual 30-Day Visa-Exemption Arrangement Between Singapore and PRC",
      "url": "https://www.ica.gov.sg/news-and-publications/newsroom/media-release/mutual-30-day-visa-exemption-arrangement-between-singapore-and-the-people-s-republic-of-china",
      "tier": "A_DESTINATION_AUTHORITY",
      "language": "en",
      "sourcePublishedAt": "2024-01-25",
      "sourceUpdatedAt": "2024-01-25",
      "lastCheckedAt": "2026-08-30T12:00:00+08:00",
      "status": "CURRENT",
      "supportsAutoDecision": true,
      "summaryZh": "中国普通护照自2024年2月9日起可免签停留最多30天。"
    },
    {
      "sourceId": "SG-ICA-ENTRY-REQUIREMENTS",
      "authority": "Immigration & Checkpoints Authority Singapore",
      "title": "Entering Singapore",
      "url": "https://www.ica.gov.sg/enter-transit-depart/entering-singapore",
      "tier": "A_DESTINATION_AUTHORITY",
      "language": "en",
      "sourcePublishedAt": null,
      "sourceUpdatedAt": null,
      "lastCheckedAt": "2026-08-30T12:00:00+08:00",
      "status": "CURRENT",
      "supportsAutoDecision": true,
      "summaryZh": "一般入境要求包括至少6个月护照有效期、续程安排、足够资金和抵达前3天内提交SG Arrival Card。"
    },
    {
      "sourceId": "SG-ICA-VFTF",
      "authority": "Immigration & Checkpoints Authority Singapore",
      "title": "Visa-Free Transit Facility",
      "url": "https://www.ica.gov.sg/enter-transit-depart/entering-singapore/visa-free-transit-facility",
      "tier": "A_DESTINATION_AUTHORITY",
      "language": "en",
      "sourcePublishedAt": null,
      "sourceUpdatedAt": null,
      "lastCheckedAt": "2026-08-30T12:00:00+08:00",
      "status": "CURRENT",
      "supportsAutoDecision": true,
      "summaryZh": "VFTF不适用于持中国普通、外交、公务或公务普通护照者；普通护照应走中新30天互免规则。"
    },
    {
      "sourceId": "KR-MOFA-TRANSIT-2025",
      "authority": "Ministry of Foreign Affairs, Republic of Korea",
      "title": "Visa Free Entry for Third Country Transit Passengers",
      "url": "https://overseas.mofa.go.kr/us-seattle-en/brd/m_23042/view.do?page=1&seq=40",
      "tier": "A_DESTINATION_AUTHORITY",
      "language": "en",
      "sourcePublishedAt": null,
      "sourceUpdatedAt": null,
      "lastCheckedAt": "2026-08-30T12:00:00+08:00",
      "status": "CURRENT",
      "supportsAutoDecision": false,
      "summaryZh": "持指定国家有效签证或居留并按规定路线经韩国过境者，满足记录、票证和前序停留条件时可按B-2停留最多30天；复杂条件必须人工复核。"
    },
    {
      "sourceId": "PH-BI-OO-2026-001",
      "authority": "Bureau of Immigration, Republic of the Philippines",
      "title": "Operations Order No. 2026-001",
      "url": "https://immigration.gov.ph/wp-content/uploads/2026/01/OPERATIONS-ORDER-No.-2026-%E2%80%93-001.pdf",
      "tier": "A_DESTINATION_AUTHORITY",
      "language": "en",
      "sourcePublishedAt": "2026-01-16",
      "sourceUpdatedAt": "2026-01-16",
      "lastCheckedAt": "2026-08-30T12:00:00+08:00",
      "status": "CURRENT",
      "supportsAutoDecision": true,
      "summaryZh": "中国公民可在指定机场以旅游或商务目的免签最多14天，但以过境第三国为目的者须预先取得菲律宾过境签证。"
    },
    {
      "sourceId": "ID-IMM-VOA-2026",
      "authority": "Directorate General of Immigration, Indonesia",
      "title": "Visa on Arrival Services for Foreign Nationals",
      "url": "https://ngurahrai.imigrasi.go.id/layanan-wna/",
      "tier": "A_DESTINATION_AUTHORITY",
      "language": "id",
      "sourcePublishedAt": null,
      "sourceUpdatedAt": "2026-08-18",
      "lastCheckedAt": "2026-08-30T12:00:00+08:00",
      "status": "CURRENT",
      "supportsAutoDecision": true,
      "summaryZh": "中国在印尼VoA适用名单中，初次停留30天，可延长一次30天，费用为500,000印尼盾。"
    },
    {
      "sourceId": "NP-IMM-TOURIST-VISA",
      "authority": "Department of Immigration, Nepal",
      "title": "Nepal Visa Information",
      "url": "https://immigration.gov.np/visa-information",
      "tier": "A_DESTINATION_AUTHORITY",
      "language": "en",
      "sourcePublishedAt": null,
      "sourceUpdatedAt": null,
      "lastCheckedAt": "2026-08-30T12:00:00+08:00",
      "status": "CURRENT",
      "supportsAutoDecision": true,
      "summaryZh": "中国游客可办理免费旅游落地签；旅游停留每个签证年度累计最多150天，首次签发期限仍以现场签注为准。"
    },
    {